{
  "id": "phase-circadian-evening-example",
  "subjectId": "synthetic-subject",
  "recordType": "phase_annotation",
  "schemaVersion": "0.2",
  "layer": "epimethean",
  "phaseSystem": "circadian_rhythm",
  "canonicalPhase": "evening_transition_context",
  "evocativeName": "The Dimming Hour",
  "description": "A person-defined transition toward rest; not a measured melatonin rise or biological night.",
  "window": {
    "kind": "interval",
    "start": "2026-10-20T20:30:00-06:00",
    "end": "2026-10-20T22:00:00-06:00",
    "timeZone": "America/Denver"
  },
  "basis": "reported",
  "interpretation": "reflective",
  "basisRecordIds": ["synthetic-evening-context"],
  "method": "Person-defined wind-down interval; no circadian phase inference.",
  "uncertainty": "The interval describes the person's chosen context, not internal circadian timing.",
  "limitations": ["Synthetic example; clock time does not establish biological night."],
  "nameSource": "metheus_suggestion"
}
